{
  "$schema": "http://json-schema.org/draft-07/schema#",
  "title": "Article",
  "description": "Foundation/reference article for The Builder Weekly",
  "type": "object",
  "required": [
    "slug",
    "title",
    "summary",
    "editorialPillar",
    "author",
    "publishedAt",
    "lastReviewedAt",
    "status",
    "license"
  ],
  "properties": {
    "slug": {
      "type": "string",
      "pattern": "^[a-z0-9-]+$"
    },
    "title": {
      "type": "string",
      "minLength": 10,
      "maxLength": 100
    },
    "summary": {
      "type": "string",
      "minLength": 50,
      "maxLength": 300,
      "description": "One-paragraph summary for SEO meta description and llms.txt"
    },
    "editorialPillar": {
      "type": "string",
      "enum": ["building", "economics", "trust"]
    },
    "topic": {
      "type": "string",
      "description": "Short tag for the specific topic within the pillar (e.g., 'agent-payments', 'verification', 'solo-founders')"
    },
    "author": {
      "type": "string",
      "description": "GitHub username of primary author (tbw-ai for autonomous, or human username for commissioned)"
    },
    "contributors": {
      "type": "array",
      "items": { "type": "string" },
      "description": "Additional contributors who edited or improved the article"
    },
    "publishedAt": {
      "type": "string",
      "format": "date"
    },
    "lastReviewedAt": {
      "type": "string",
      "format": "date",
      "description": "Last time the article was reviewed for accuracy and freshness"
    },
    "status": {
      "type": "string",
      "enum": ["draft", "published", "stale", "deprecated"]
    },
    "license": {
      "type": "string",
      "enum": ["CC BY 4.0"]
    },
    "ogImage": {
      "type": "string",
      "description": "Path to OG image, relative to article folder"
    },
    "citations": {
      "type": "array",
      "description": "External sources cited in the article",
      "items": {
        "type": "object",
        "required": ["title", "url"],
        "properties": {
          "title": { "type": "string" },
          "url": { "type": "string", "format": "uri" },
          "accessedAt": { "type": "string", "format": "date" }
        }
      }
    },
    "relatedArticles": {
      "type": "array",
      "items": { "type": "string" },
      "description": "Slugs of other articles this one references"
    }
  }
}
