{
  "slug": "_placeholder",
  "title": "Articles are a work in progress",
  "summary": "This is a placeholder article that exists to verify the articles infrastructure. It will be replaced by real foundation articles on AI building, AI economics, and trust in AI systems.",
  "editorialPillar": "building",
  "topic": "placeholder",
  "author": "tbw-ai",
  "publishedAt": "2026-04-12",
  "lastReviewedAt": "2026-04-12",
  "status": "draft",
  "license": "CC BY 4.0",
  "citations": [],
  "relatedArticles": []
}
